{
  "name": "Hyperbolic Tessellation Engine",
  "category": "generative",
  "tags": [
    "hyperbolic",
    "tessellation",
    "fractal",
    "non-euclidean",
    "escher",
    "geometric",
    "generative",
    "audio",
    "music"
  ],
  "description": "Non-Euclidean Poincaré-disk tessellation in real-time. Hyperbolic tiles subdivide infinitely toward the boundary disk, colored by recursive depth — M.C. Escher meets fractals.",
  "workgroup_size": [
    16,
    16,
    1
  ],
  "params": [
    {
      "id": "tileSymmetry",
      "name": "Tile Symmetry",
      "default": 0.4,
      "min": 0,
      "max": 1,
      "step": 0.01,
      "mapping": "zoom_params.x"
    },
    {
      "id": "depthColor",
      "name": "Depth Color",
      "default": 0.2,
      "min": 0,
      "max": 1,
      "step": 0.01,
      "mapping": "zoom_params.y"
    },
    {
      "id": "rotationSpeed",
      "name": "Rotation Speed",
      "default": 0.5,
      "min": 0,
      "max": 1,
      "step": 0.01,
      "mapping": "zoom_params.z"
    },
    {
      "id": "boundaryGlow",
      "name": "Boundary Glow",
      "default": 0.7,
      "min": 0,
      "max": 1,
      "step": 0.01,
      "mapping": "zoom_params.w"
    }
  ],
  "supportsDepth": true,
  "supportsDof": false,
  "updated": true,
  "id": "gen-hyperbolic-tessellation",
  "url": "shaders/gen-hyperbolic-tessellation.wgsl",
  "features": [
    "upgraded-rgba",
    "hyperbolic-geometry",
    "recursive",
    "audio-reactive",
    "mouse-driven",
    "mouse-interactive",
    "held-interactive",
    "ripple-reactive",
    "temporal-feedback",
    "semantic-alpha",
    "aces-tone-mapping",
    "depth-aware"
  ],
  "feedbackPacking": "A/C = raw HDR tessellation display RGBA history; depth = normalized recursive depth",
  "x-meta": {
    "upgrade": {
      "params": [
        {
          "index": 0,
          "name": "Tile Symmetry",
          "default": 0.4,
          "min": 0,
          "max": 1,
          "step": 0.01
        },
        {
          "index": 1,
          "name": "Depth Color",
          "default": 0.2,
          "min": 0,
          "max": 1,
          "step": 0.01
        },
        {
          "index": 2,
          "name": "Rotation Speed",
          "default": 0.5,
          "min": 0,
          "max": 1,
          "step": 0.01
        },
        {
          "index": 3,
          "name": "Boundary Glow",
          "default": 0.7,
          "min": 0,
          "max": 1,
          "step": 0.01
        }
      ]
    }
  }
}
