{
  "id": "oscilloscope-overlay",
  "name": "Oscilloscope Overlay",
  "url": "shaders/oscilloscope-overlay.wgsl",
  "description": "Scope trace of the scanline under the cursor. The beam blanks at the right edge, and last frame's trace ghosts in the phosphor.",
  "params": [
    {
      "id": "amplitude",
      "name": "Amplitude",
      "default": 0.5,
      "min": 0,
      "max": 1
    },
    {
      "id": "thickness",
      "name": "Line Thickness",
      "default": 0.2,
      "min": 0,
      "max": 1
    },
    {
      "id": "opacity",
      "name": "Wave Opacity",
      "default": 0.8,
      "min": 0,
      "max": 1
    },
    {
      "id": "scan_alpha",
      "name": "Scanline Alpha",
      "default": 0.3,
      "min": 0,
      "max": 1
    }
  ],
  "features": [
    "mouse-driven",
    "overlay",
    "audio-reactive",
    "audio-envelope",
    "sparkle",
    "hdr",
    "aces-tone-map",
    "color-temperature",
    "dither"
  ],
  "tags": [
    "filter",
    "image-processing",
    "overlay",
    "audio-reactive",
    "audio-envelope",
    "sparkle"
  ]
}
