{
  "id": "chromatic-swirl",
  "category": "distortion",
  "url": "shaders/chromatic-swirl.wgsl",
  "icon": "cyclone",
  "features": [
    "mouse-driven",
    "audio-reactive",
    "upgraded-rgba"
  ],
  "params": [
    {
      "id": "param1",
      "name": "Swirl Strength",
      "default": 0.5,
      "min": 0,
      "max": 1
    },
    {
      "id": "param2",
      "name": "Radius",
      "default": 0.5,
      "min": 0,
      "max": 1
    },
    {
      "id": "param3",
      "name": "Aberration",
      "default": 0.5,
      "min": 0,
      "max": 1
    },
    {
      "id": "param4",
      "name": "Auto Rotation",
      "default": 0,
      "min": 0,
      "max": 1,
      "step": 1
    }
  ],
  "tags": [
    "chromatic",
    "swirl",
    "distort",
    "audio-reactive"
  ],
  "name": "Chromatic Swirl"
}
