{
  "id": "cellular-automata-rgba",
  "name": "Cellular Automata RGBA",
  "url": "shaders/cellular-automata-rgba.wgsl",
  "description": "2D ecosystem cellular automaton with four interacting species packed into RGBA. Plants grow from nutrients, herbivores eat plants, predators eat herbivores, and all dead matter cycles back to soil nutrients. Continuous densities enable stable predator-prey oscillations.",
  "tags": [
    "simulation",
    "cellular-automata",
    "ecosystem",
    "interactive",
    "mouse-driven",
    "rgba-state-machine",
    "organic",
    "predator-prey"
  ],
  "features": [
    "mouse-driven",
    "temporal",
    "rgba-state-machine",
    "audio-reactive",
    "upgraded-rgba"
  ],
  "params": [
    {
      "id": "growthRate",
      "name": "Plant Growth",
      "default": 0.5,
      "min": 0,
      "max": 1,
      "step": 0.01
    },
    {
      "id": "herbivoreEff",
      "name": "Herbivore Efficiency",
      "default": 0.5,
      "min": 0,
      "max": 1,
      "step": 0.01
    },
    {
      "id": "predatorEff",
      "name": "Predator Efficiency",
      "default": 0.5,
      "min": 0,
      "max": 1,
      "step": 0.01
    },
    {
      "id": "decayRate",
      "name": "Decay Rate",
      "default": 0.5,
      "min": 0,
      "max": 1,
      "step": 0.01
    }
  ],
  "feedbackPacking": "A/C = plants, herbivores, predators, nutrients",
  "updated": true,
  "x-meta": {
    "upgrade": {
      "params": [
        {
          "index": 0,
          "name": "Plant Growth",
          "default": 0.5,
          "min": 0,
          "max": 1,
          "step": 0.01
        },
        {
          "index": 1,
          "name": "Herbivore Efficiency",
          "default": 0.5,
          "min": 0,
          "max": 1,
          "step": 0.01
        },
        {
          "index": 2,
          "name": "Predator Efficiency",
          "default": 0.5,
          "min": 0,
          "max": 1,
          "step": 0.01
        },
        {
          "index": 3,
          "name": "Decay Rate",
          "default": 0.5,
          "min": 0,
          "max": 1,
          "step": 0.01
        }
      ]
    }
  }
}
