{
  "name": "Luminescent Quantum-Void Anglerfish",
  "category": "generative",
  "tags": [
    "cosmic",
    "anglerfish",
    "quantum",
    "mechanical",
    "organic",
    "audio-reactive",
    "volumetric"
  ],
  "description": "A colossal, biomechanical deep-space anglerfish prowling through a dark-matter ocean.",
  "workgroup_size": [
    16,
    16,
    1
  ],
  "supportsDepth": true,
  "supportsDof": false,
  "updated": true,
  "id": "gen-luminescent-quantum-void-anglerfish",
  "url": "shaders/gen-luminescent-quantum-void-anglerfish.wgsl",
  "params": [
    {
      "id": "jawRotation",
      "name": "Jaw Rotation",
      "mapping": "zoom_params.x",
      "default": 0.5,
      "min": 0.0,
      "max": 1.0,
      "step": 0.01
    },
    {
      "id": "lureIntensity",
      "name": "Lure Intensity",
      "mapping": "zoom_params.y",
      "default": 1.0,
      "min": 0.5,
      "max": 5.0,
      "step": 0.1
    },
    {
      "id": "voidDensity",
      "name": "Void Density",
      "mapping": "zoom_params.z",
      "default": 0.8,
      "min": 0.1,
      "max": 2.0,
      "step": 0.05
    },
    {
      "id": "fractalRust",
      "name": "Fractal Rust",
      "mapping": "zoom_params.w",
      "default": 0.5,
      "min": 0.0,
      "max": 1.0,
      "step": 0.05
    }
  ],
  "features": [
    "audio-reactive",
    "mouse-driven",
    "upgraded-rgba"
  ],
  "x-meta": {
    "upgrade": {
      "params": [
        {
          "index": 0,
          "name": "Jaw Rotation",
          "default": 0.5,
          "min": 0.0,
          "max": 1.0,
          "step": 0.01
        },
        {
          "index": 1,
          "name": "Lure Intensity",
          "default": 1.0,
          "min": 0.5,
          "max": 5.0,
          "step": 0.1
        },
        {
          "index": 2,
          "name": "Void Density",
          "default": 0.8,
          "min": 0.1,
          "max": 2.0,
          "step": 0.05
        },
        {
          "index": 3,
          "name": "Fractal Rust",
          "default": 0.5,
          "min": 0.0,
          "max": 1.0,
          "step": 0.05
        }
      ]
    }
  }
}