{
  "id": "gen-wave-equation",
  "name": "Fluid Ripples",
  "url": "shaders/gen_wave_equation.wgsl",
  "description": "Audio-reactive water ripple simulation with wave interference. Bass amplifies wave energy and mouse-driven pulses. Parameters control intensity, speed, scale, and damping detail.",
  "features": [
    "mouse-driven",
    "audio-reactive",
    "upgraded-rgba",
    "depth-aware",
    "temporal"
  ],
  "tags": [
    "procedural",
    "generative",
    "liquid",
    "waves",
    "audio-reactive",
    "vj"
  ],
  "params": [
    {
      "id": "intensity",
      "name": "Intensity",
      "default": 0.5,
      "min": 0,
      "max": 1,
      "step": 0.01,
      "mapping": "zoom_params.x"
    },
    {
      "id": "speed",
      "name": "Speed",
      "default": 0.5,
      "min": 0,
      "max": 1,
      "step": 0.01,
      "mapping": "zoom_params.y"
    },
    {
      "id": "scale",
      "name": "Scale",
      "default": 0.5,
      "min": 0,
      "max": 1,
      "step": 0.01,
      "mapping": "zoom_params.z"
    },
    {
      "id": "detail",
      "name": "Detail",
      "default": 0.5,
      "min": 0,
      "max": 1,
      "step": 0.01,
      "mapping": "zoom_params.w"
    }
  ],
  "updated": true,
  "category": "generative",
  "x-meta": {
    "upgrade": {
      "params": [
        {
          "index": 0,
          "name": "Intensity",
          "default": 0.5,
          "min": 0.0,
          "max": 1.0,
          "step": 0.01
        },
        {
          "index": 1,
          "name": "Speed",
          "default": 0.5,
          "min": 0.0,
          "max": 1.0,
          "step": 0.01
        },
        {
          "index": 2,
          "name": "Scale",
          "default": 0.5,
          "min": 0.0,
          "max": 1.0,
          "step": 0.01
        },
        {
          "index": 3,
          "name": "Detail",
          "default": 0.5,
          "min": 0.0,
          "max": 1.0,
          "step": 0.01
        }
      ]
    }
  }
}
