{
  "id": "rain-lens-wipe",
  "name": "Rain Lens Wipe",
  "url": "shaders/rain-lens-wipe.wgsl",
  "description": "Stylized falling lens drops and rapid water streak packets distort the image while the mouse wipes an advected clean-state mask and clicks launch expanding wipe fronts. Depth is passed through unchanged.",
  "params": [
    {
      "id": "strength",
      "name": "Rain Strength",
      "default": 0.5,
      "min": 0,
      "max": 1
    },
    {
      "id": "decay",
      "name": "Re-fog Speed",
      "default": 0.2,
      "min": 0,
      "max": 1
    },
    {
      "id": "radius",
      "name": "Wipe Radius",
      "default": 0.5,
      "min": 0,
      "max": 1
    },
    {
      "id": "density",
      "name": "Rain Density",
      "default": 0.4,
      "min": 0,
      "max": 1
    }
  ],
  "features": [
    "mouse-driven",
    "audio-reactive",
    "temporal",
    "fast-motion",
    "click-reactive",
    "bounded-history",
    "upgraded-rgba"
  ],
  "tags": [
    "filter",
    "image-processing"
  ],
  "x-meta": {
    "upgrade": {
      "params": [
        {
          "index": 0,
          "name": "Rain Strength",
          "default": 0.5,
          "min": 0,
          "max": 1,
          "step": 0.01
        },
        {
          "index": 1,
          "name": "Re-fog Speed",
          "default": 0.2,
          "min": 0,
          "max": 1,
          "step": 0.01
        },
        {
          "index": 2,
          "name": "Wipe Radius",
          "default": 0.5,
          "min": 0,
          "max": 1,
          "step": 0.01
        },
        {
          "index": 3,
          "name": "Rain Density",
          "default": 0.4,
          "min": 0,
          "max": 1,
          "step": 0.01
        }
      ]
    }
  }
}
