{
  "id": "conv-frequency-domain-notch",
  "name": "Frequency Domain Notch",
  "description": "Spatial-domain approximation of frequency notch filtering using tuned sinusoidal convolution kernels. Removes moire patterns or creates frequency painting. Alpha stores spectral response magnitude. Mouse selects target frequency band.",
  "url": "shaders/conv-frequency-domain-notch.wgsl",
  "features": [
    "advanced-convolution",
    "rgba32float-exploiting",
    "mouse-driven",
    "upgraded-rgba",
    "audio-reactive"
  ],
  "params": [
    {
      "id": "num_bands",
      "name": "Frequency Bands",
      "default": 0.4,
      "min": 0,
      "max": 1,
      "step": 0.01,
      "mapping": "zoom_params.x"
    },
    {
      "id": "bandwidth",
      "name": "Notch Bandwidth",
      "default": 0.3,
      "min": 0,
      "max": 1,
      "step": 0.01,
      "mapping": "zoom_params.y"
    },
    {
      "id": "boost_cut",
      "name": "Boost / Cut",
      "default": 0,
      "min": 0,
      "max": 1,
      "step": 0.01,
      "mapping": "zoom_params.z"
    },
    {
      "id": "mouse_influence",
      "name": "Mouse Frequency",
      "default": 0.5,
      "min": 0,
      "max": 1,
      "step": 0.01,
      "mapping": "zoom_params.w"
    }
  ],
  "tags": [
    "frequency-notch",
    "spectral",
    "convolution",
    "moire-removal",
    "frequency-painting",
    "filter",
    "image-processing"
  ],
  "x-meta": {
    "upgrade": {
      "params": [
        {
          "index": 0,
          "name": "Frequency Bands",
          "default": 0.4,
          "min": 0,
          "max": 1,
          "step": 0.01
        },
        {
          "index": 1,
          "name": "Notch Bandwidth",
          "default": 0.3,
          "min": 0,
          "max": 1,
          "step": 0.01
        },
        {
          "index": 2,
          "name": "Boost / Cut",
          "default": 0,
          "min": 0,
          "max": 1,
          "step": 0.01
        },
        {
          "index": 3,
          "name": "Mouse Frequency",
          "default": 0.5,
          "min": 0,
          "max": 1,
          "step": 0.01
        }
      ]
    }
  }
}
