{
  "id": "neural-mandala",
  "name": "Neural Mandala",
  "category": "generative",
  "url": "shaders/neural-mandala.wgsl",
  "description": "Concentric geometric rings with interconnected node networks that pulse and evolve. Audio drives ring expansion and node brightness.",
  "features": [
    "audio-reactive",
    "generative",
    "geometric-recursion",
    "upgraded-rgba",
    "pulsing-nodes",
    "mouse-driven"
  ],
  "params": [
    {
      "id": "rings",
      "name": "Ring Count",
      "default": 0.4,
      "min": 0,
      "max": 1,
      "mapping": "zoom_params.x"
    },
    {
      "id": "complexity",
      "name": "Node Complexity",
      "default": 0.5,
      "min": 0,
      "max": 1,
      "mapping": "zoom_params.y"
    },
    {
      "id": "pulse",
      "name": "Pulse Speed",
      "default": 0.4,
      "min": 0,
      "max": 1,
      "mapping": "zoom_params.z"
    },
    {
      "id": "connections",
      "name": "Connection Density",
      "default": 0.5,
      "min": 0,
      "max": 1,
      "mapping": "zoom_params.w"
    }
  ],
  "tags": [
    "generative",
    "mandala",
    "geometric",
    "network",
    "nodes",
    "audio-reactive",
    "pulsing",
    "abstract"
  ],
  "updated": true,
  "x-meta": {
    "upgrade": {
      "params": [
        {
          "index": 0,
          "name": "Ring Count",
          "default": 0.4,
          "min": 0.0,
          "max": 1.0,
          "step": 0.01
        },
        {
          "index": 1,
          "name": "Node Complexity",
          "default": 0.5,
          "min": 0.0,
          "max": 1.0,
          "step": 0.01
        },
        {
          "index": 2,
          "name": "Pulse Speed",
          "default": 0.4,
          "min": 0.0,
          "max": 1.0,
          "step": 0.01
        },
        {
          "index": 3,
          "name": "Connection Density",
          "default": 0.5,
          "min": 0.0,
          "max": 1.0,
          "step": 0.01
        }
      ]
    }
  }
}
