{
  "id": "color-blindness",
  "name": "Color Blindness Sim",
  "url": "shaders/color-blindness.wgsl",
  "description": "Simulates various forms of color blindness (Protanopia, Deuteranopia, Tritanopia) with split-screen comparison.",
  "params": [
    {
      "id": "type",
      "name": "Type (P/D/T)",
      "default": 0,
      "min": 0,
      "max": 1
    },
    {
      "id": "severity",
      "name": "Severity",
      "default": 1,
      "min": 0,
      "max": 1
    },
    {
      "id": "split",
      "name": "Split Screen",
      "default": 1,
      "min": 0,
      "max": 1
    },
    {
      "id": "unused",
      "name": "Unused",
      "default": 0,
      "min": 0,
      "max": 1
    }
  ],
  "features": [
    "mouse-driven",
    "audio-reactive",
    "upgraded-rgba"
  ],
  "tags": [
    "filter",
    "image-processing"
  ],
  "x-meta": {
    "upgrade": {
      "params": [
        {
          "index": 0,
          "name": "Type (P/D/T)",
          "default": 0,
          "min": 0,
          "max": 1,
          "step": 0.01
        },
        {
          "index": 1,
          "name": "Severity",
          "default": 1,
          "min": 0,
          "max": 1,
          "step": 0.01
        },
        {
          "index": 2,
          "name": "Split Screen",
          "default": 1,
          "min": 0,
          "max": 1,
          "step": 0.01
        },
        {
          "index": 3,
          "name": "Unused",
          "default": 0,
          "min": 0,
          "max": 1,
          "step": 0.01
        }
      ]
    }
  }
}
