{
  "id": "chromatic-reaction-diffusion-rgba",
  "name": "Chromatic Reaction Diffusion RGBA",
  "url": "shaders/chromatic-reaction-diffusion-rgba.wgsl",
  "description": "Two cross-coupled warm/cool Gray-Scott systems with competitive overlap quench, photo chroma seeding, pointer spiral inoculation, bounded click fronts, and ACES display. Raw chemistry persists in dataTextureA.",
  "tags": [
    "reaction-diffusion",
    "simulation",
    "interactive",
    "mouse-driven",
    "pattern",
    "rgba-state-machine",
    "chromatic",
    "colorful"
  ],
  "features": [
    "mouse-driven",
    "temporal",
    "rgba-state-machine",
    "audio-reactive",
    "upgraded-rgba"
  ],
  "params": [
    {
      "id": "feed",
      "name": "Feed Rate",
      "default": 0.5,
      "min": 0,
      "max": 1,
      "step": 0.01
    },
    {
      "id": "kill",
      "name": "Kill Rate",
      "default": 0.5,
      "min": 0,
      "max": 1,
      "step": 0.01
    },
    {
      "id": "chromaticSep",
      "name": "Chromatic Separation",
      "default": 0.3,
      "min": 0,
      "max": 1,
      "step": 0.01
    },
    {
      "id": "crossCouple",
      "name": "Cross Coupling",
      "default": 0.3,
      "min": 0,
      "max": 1,
      "step": 0.01
    }
  ],
  "updated": true,
  "feedbackPacking": "A/C = warm U, warm V, cool U, cool V. ACES display only.",
  "x-meta": {
    "upgrade": {
      "params": [
        {
          "id": "param1",
          "name": "Feed Rate",
          "default": 0.5,
          "min": 0,
          "max": 1,
          "step": 0.01
        },
        {
          "id": "param2",
          "name": "Kill Rate",
          "default": 0.5,
          "min": 0,
          "max": 1,
          "step": 0.01
        },
        {
          "id": "param3",
          "name": "Chromatic Separation",
          "default": 0.3,
          "min": 0,
          "max": 1,
          "step": 0.01
        },
        {
          "id": "param4",
          "name": "Cross Coupling",
          "default": 0.3,
          "min": 0,
          "max": 1,
          "step": 0.01
        }
      ]
    }
  }
}
