{
  "id": "crt-magnet",
  "name": "CRT Magnet",
  "url": "shaders/crt-magnet.wgsl",
  "description": "CRT degaussing distortion with continuous magnetic rings and rolling beam sweeps, held-pointer field gain, bounded click shocks, exact-load feedback echo, aperture grille, hex bloom, spectral palette, and preserved A-state packing.",
  "updated": true,
  "params": [
    {
      "id": "magnet_strength",
      "name": "Magnet Strength",
      "default": 0.5,
      "min": 0,
      "max": 1
    },
    {
      "id": "bloom_intensity",
      "name": "Bloom Intensity",
      "default": 0.4,
      "min": 0,
      "max": 1
    },
    {
      "id": "color_shift",
      "name": "Color Shift",
      "default": 0.3,
      "min": 0,
      "max": 1
    },
    {
      "id": "distortion_radius",
      "name": "Distortion Radius",
      "default": 0.5,
      "min": 0,
      "max": 1
    }
  ],
  "workgroup_size": [
    16,
    16,
    1
  ],
  "features": [
    "mouse-driven",
    "audio-reactive",
    "depth-aware",
    "upgraded-rgba",
    "aces-tone-map",
    "feedback-echo",
    "audio-palette",
    "sdf-mask",
    "continuous-motion",
    "bounded-click-ripples",
    "spring-cursor",
    "held-drag"
  ],
  "tags": [
    "filter",
    "image-processing",
    "noise",
    "curl",
    "fractal",
    "crt",
    "magnet",
    "bloom",
    "feedback",
    "palette",
    "sdf",
    "hybrid"
  ],
  "x-meta": {
    "upgrade": {
      "params": [
        {
          "id": "magnet_strength",
          "name": "Magnet Strength",
          "default": 0.5,
          "min": 0,
          "max": 1
        },
        {
          "id": "bloom_intensity",
          "name": "Bloom Intensity",
          "default": 0.4,
          "min": 0,
          "max": 1
        },
        {
          "id": "color_shift",
          "name": "Color Shift",
          "default": 0.3,
          "min": 0,
          "max": 1
        },
        {
          "id": "distortion_radius",
          "name": "Distortion Radius",
          "default": 0.5,
          "min": 0,
          "max": 1
        }
      ]
    }
  }
}
