{
  "id": "ethereal-swirl",
  "name": "Ethereal Swirl",
  "url": "shaders/ethereal-swirl.wgsl",
  "description": "Billow clouds swirl over the footage and leave trails. The cloud edge carries a silver lining along the flow, and the photo smears one step downstream before the blend.",
  "features": [
    "audio-reactive",
    "audio-driven",
    "temporal",
    "upgraded-rgba"
  ],
  "tags": [
    "filter",
    "image-processing",
    "audio",
    "music",
    "reactive"
  ],
  "params": [
    {
      "id": "cloud_scale",
      "name": "Cloud Scale",
      "default": 0.5,
      "min": 0,
      "max": 1,
      "step": 0.01
    },
    {
      "id": "flow_speed",
      "name": "Flow Speed",
      "default": 0.5,
      "min": 0,
      "max": 1,
      "step": 0.01
    },
    {
      "id": "color_speed",
      "name": "Color Speed",
      "default": 0.5,
      "min": 0,
      "max": 1,
      "step": 0.01
    },
    {
      "id": "persistence",
      "name": "Persistence",
      "default": 0.5,
      "min": 0,
      "max": 1,
      "step": 0.01
    }
  ],
  "x-meta": {
    "upgrade": {
      "params": [
        {
          "index": 0,
          "name": "Cloud Scale",
          "default": 0.5,
          "min": 0,
          "max": 1,
          "step": 0.01
        },
        {
          "index": 1,
          "name": "Flow Speed",
          "default": 0.5,
          "min": 0,
          "max": 1,
          "step": 0.01
        },
        {
          "index": 2,
          "name": "Color Speed",
          "default": 0.5,
          "min": 0,
          "max": 1,
          "step": 0.01
        },
        {
          "index": 3,
          "name": "Persistence",
          "default": 0.5,
          "min": 0,
          "max": 1,
          "step": 0.01
        }
      ]
    }
  }
}
