{
  "id": "aurora-rift",
  "name": "Aurora Rift",
  "url": "shaders/aurora-rift.wgsl",
  "description": "Aurora borealis-inspired lighting effects with atmospheric rifts.",
  "features": [
    "mouse-driven"
  ],
  "tags": [
    "filter",
    "image-processing"
  ],
  "params": [
    {
      "id": "scale",
      "name": "Scale",
      "default": 0.5,
      "min": 0,
      "max": 1,
      "step": 0.01
    },
    {
      "id": "flow_speed",
      "name": "Flow Speed",
      "default": 0.5,
      "min": 0,
      "max": 1,
      "step": 0.01
    },
    {
      "id": "diffusion_rate",
      "name": "Diffusion Rate",
      "default": 0.5,
      "min": 0,
      "max": 1,
      "step": 0.01
    },
    {
      "id": "fbm_octaves",
      "name": "FBM Octaves",
      "default": 0.5,
      "min": 0,
      "max": 1,
      "step": 0.01
    }
  ]
}
