{
  "id": "aurora-rift-pass2",
  "name": "Aurora Rift (Pass 2: Atmospheric Scattering)",
  "url": "shaders/aurora-rift-pass2.wgsl",
  "description": "Atmospheric scattering and grade of the aurora rift: chromatic dispersion, an airglow limb, and Rayleigh reddening toward the horizon. Second pass of 2-pass system.",
  "features": [
    "multi-pass-2",
    "compute-shader",
    "post-processing",
    "tone-mapping",
    "audio-reactive",
    "upgraded-rgba"
  ],
  "multipass": {
    "pass": 2,
    "totalPasses": 2,
    "prevShader": "aurora-rift-pass1"
  },
  "tags": [
    "aurora",
    "scattering",
    "grading",
    "post-processing"
  ],
  "params": [
    {
      "id": "scale",
      "name": "Scale",
      "default": 0.5,
      "min": 0,
      "max": 1,
      "step": 0.01
    },
    {
      "id": "flow_speed",
      "name": "Flow Speed",
      "default": 0.5,
      "min": 0,
      "max": 1,
      "step": 0.01
    },
    {
      "id": "diffusion_rate",
      "name": "Diffusion Rate",
      "default": 0.5,
      "min": 0,
      "max": 1,
      "step": 0.01
    },
    {
      "id": "fbm_octaves",
      "name": "FBM Octaves",
      "default": 0.5,
      "min": 0,
      "max": 1,
      "step": 0.01
    }
  ],
  "x-meta": {
    "upgrade": {
      "params": [
        { "index": 0, "name": "Scale", "default": 0.5, "min": 0, "max": 1, "step": 0.01 },
        { "index": 1, "name": "Flow Speed", "default": 0.5, "min": 0, "max": 1, "step": 0.01 },
        { "index": 2, "name": "Diffusion Rate", "default": 0.5, "min": 0, "max": 1, "step": 0.01 },
        { "index": 3, "name": "FBM Octaves", "default": 0.5, "min": 0, "max": 1, "step": 0.01 }
      ]
    }
  }
}
