{
  "name": "Von K\u00e1rm\u00e1n Vortex Street",
  "category": "generative",
  "tags": [
    "fluid-dynamics",
    "vortex",
    "karman",
    "analytic",
    "physics",
    "audio-reactive"
  ],
  "description": "Analytic vortex-street flow visualization. Ten alternating point-vortex pairs shed behind the mouse-driven obstacle; their combined streamfunction \u03c8 = U\u00b7y + \u03a3 \u00b1(\u0393/2\u03c0)\u00b7ln(r) produces isocontours tracing the classic K\u00e1rm\u00e1n street wake. Envelope-smoothed bass drives shedding speed and brightness pulses; mids morph vortex separation and color cycling; treble adds high-frequency sparkle along fast streamlines.",
  "workgroup_size": [
    16,
    16,
    1
  ],
  "supportsDepth": true,
  "supportsDof": false,
  "updated": true,
  "id": "gen-von-karman-vortex",
  "url": "shaders/gen-von-karman-vortex.wgsl",
  "params": [
    { "id": "flow_speed", "name": "Flow Speed", "default": 0.4, "min": 0, "max": 1, "step": 0.01, "mapping": "zoom_params.x" },
    { "id": "vortex_separation", "name": "Vortex Separation", "default": 0.4, "min": 0, "max": 1, "step": 0.01, "mapping": "zoom_params.y" },
    { "id": "vortex_spacing", "name": "Vortex Spacing", "default": 0.5, "min": 0, "max": 1, "step": 0.01, "mapping": "zoom_params.z" },
    { "id": "colour_hue", "name": "Colour Hue", "default": 0, "min": 0, "max": 1, "step": 0.01, "mapping": "zoom_params.w" }
  ],
  "features": [
    "audio-reactive"
  ],
  "x-meta": {
    "upgrade": {
      "params": [
        {
          "index": 0,
          "name": "Flow Speed",
          "default": 0.4,
          "min": 0,
          "max": 1,
          "step": 0.01
        },
        {
          "index": 1,
          "name": "Vortex Separation",
          "default": 0.4,
          "min": 0,
          "max": 1,
          "step": 0.01
        },
        {
          "index": 2,
          "name": "Vortex Spacing",
          "default": 0.5,
          "min": 0,
          "max": 1,
          "step": 0.01
        },
        {
          "index": 3,
          "name": "Colour Hue",
          "default": 0,
          "min": 0,
          "max": 1,
          "step": 0.01
        }
      ]
    }
  }
}
