{
  "id": "slime-drip",
  "name": "Slime Drip",
  "category": "image",
  "url": "shaders/slime-drip.wgsl",
  "description": "A gooey, dripping slime effect that can be wiped away.",
  "params": [
    {
      "id": "speed",
      "name": "Drip Speed",
      "default": 0.5,
      "min": 0,
      "max": 1
    },
    {
      "id": "viscosity",
      "name": "Viscosity",
      "default": 0.5,
      "min": 0,
      "max": 1
    },
    {
      "id": "amount",
      "name": "Slime Amount",
      "default": 0.5,
      "min": 0,
      "max": 1
    },
    {
      "id": "color",
      "name": "Green Tint",
      "default": 0.8,
      "min": 0,
      "max": 1
    }
  ],
  "features": [
    "mouse-driven",
    "audio-reactive",
    "upgraded-rgba"
  ],
  "tags": [
    "slime",
    "goo",
    "organic",
    "audio-reactive"
  ]
}
